{
  "#$schema": "https://json-schema.org/draft/2020-12/schema",
  "$schema": "http://json-schema.org/draft-07/schema#",
  "type": "object",
  "required": ["id", "title", "description"],
  "properties": {
    "id": {
      "type": "string",
      "pattern": "^[a-z0-9]+\\.[a-z0-9_.]+$"
    },
    "title": {
      "type": "object",
      "properties": {
        "en": { "type": "string" },
        "cs": { "type": "string" }
      }
    },
    "description": {
      "type": "object",
      "properties": {
        "en": { "type": "string" },
        "cs": { "type": "string" }
      }
    },
    "relatedKeywords": {
      "type": "array",
      "items": { "type": "string" }
    },
    "relatedFeatures": {
      "type": "array",
      "items": { "type": "string" }
    }
  }
}

